nume,categorie,descriere,pret,pret_original,brand,stoc,marimi,culori,imagini,featured,nou,reducere
Adidas Ultraboost 22,Adidași bărbați,Adidași de alergare cu tehnologie Boost pentru confort maxim.,599,799,Adidas,20,"40,41,42,43,44,45","Alb,Negru,Gri",https://link-imagine.ro/adidas-ultraboost.jpg,true,true,false
Nike Air Max 270,Adidași femei,Adidași casual cu perna de aer vizibila pentru confort toata ziua.,449,549,Nike,15,"36,37,38,39,40","Roz,Alb,Negru",https://link-imagine.ro/nike-airmax.jpg,true,false,false
Adidași Copii Star Wars,Adidași copii,Adidași colorati cu personaje Star Wars pentru copii.,199,249,Adidas,25,"28,29,30,31,32,33","Albastru,Negru",https://link-imagine.ro/adidasi-copii.jpg,false,true,false
Ghete Impermeabile Copii,Ghete copii,Ghete calduroase si impermeabile pentru sezonul rece.,249,299,Geox,20,"28,29,30,31,32,33,34,35","Maro,Negru",https://link-imagine.ro/ghete-copii.jpg,true,false,false
Botine Piele Femei,Pantofi femei,Botine elegante din piele naturala cu toc mic.,349,449,Ecco,12,"36,37,38,39,40","Negru,Maro","https://link-imagine.ro/botine-femei.jpg",false,false,true
Geanta Tote Piele,Accesorii,Geanta tote din piele ecologica spatioasa si eleganta.,199,249,Zara,30,"","Negru,Maro,Bej",https://link-imagine.ro/geanta-tote.jpg,true,false,false
